{
  "$schema": "../../schemas/v1.7.1-section48-trust-qualification-plan.schema.json",
  "schemaVersion": 1,
  "planId": "goreecloud.glaze.v1.7.1.section48-trust-qualification",
  "name": "Glaze V1.7.1 Section 48 Provider and Privacy/Security Qualification Plan",
  "lifecycle": "DevelopmentQualification",
  "successorReleaseLine": "1.7.1",
  "developmentIdentity": "1.7.1-dev.1",
  "sourceRevision": "4b9d085a5177b96cc31d4270b38d792a59872e37",
  "sourceModelVersion": "1.7.0-dev.47",
  "section48QualificationModelVersion": "1.7.0-dev.47",
  "stableBaseline": "1.7.0",
  "historicalSourceStableBaseline": "1.6.0",
  "consumerEligible": false,
  "evidenceTypes": [
    "provider-integration",
    "privacy-security"
  ],
  "providerIntegrationLaneIds": [
    "agent-activity-authority-v13",
    "care-authority-v13",
    "provider-integration-v13",
    "contextual-actions-v13",
    "brief-v13",
    "control-center-v13"
  ],
  "privacySecurityLaneIds": [
    "privacy-attention-authority-v13",
    "privacy-security-integration-v13"
  ],
  "governance": {
    "privacyPolicy": "GoreeCloud \u2014 Policy \u2014 Privacy and Data Protection",
    "privacyShieldPolicy": "Policy \u2014 Privacy Shield Integration and Conformance",
    "wardveilPolicy": "Policy \u2014 Wardveil Security Integration and Conformance",
    "integrationArchitecture": "Architecture \u2014 Application Integration and Interoperability"
  },
  "record": {
    "manualExecutionRequired": true,
    "liveIntegrationRequired": true,
    "placeholderValuesProhibited": true,
    "oneRecordTargetsOneLane": true,
    "sourceRevisionFormat": "40-lowercase-hex",
    "toolingRevisionFormat": "40-lowercase-hex",
    "integrationRevisionFormat": "40-lowercase-hex",
    "repository": "GoreeCloud/glaze",
    "scenarioStatusValues": [
      "pass",
      "fail"
    ],
    "sessionDecisionValues": [
      "session-pass",
      "session-fail"
    ]
  },
  "providerIntegrationScenarios": [
    "source-and-integration-identity",
    "provider-identity-and-provenance",
    "least-privilege-contract",
    "provider-truth-authority",
    "execution-and-result-boundary",
    "failure-isolation-and-revocation",
    "data-minimization-and-secret-exclusion",
    "contract-versioning-and-compatibility"
  ],
  "privacySecurityScenarios": [
    "source-and-integration-identity",
    "privacy-by-default-and-data-minimization",
    "wardveil-security-authority",
    "privacy-shield-authority",
    "provider-local-scope-boundary",
    "conflict-and-unattested-fail-closed",
    "truth-presentation-separation",
    "permission-revocation-and-denial",
    "telemetry-and-secret-exclusion"
  ],
  "providerIntegrationRules": {
    "providerIdentityMustBeAuthoritative": true,
    "providerOwnsProviderTruth": true,
    "glazeMayExecuteProviderCommands": false,
    "glazeMayAssumeProviderResults": false,
    "glazeMayGrantPermissionOrAuthorization": false,
    "leastPrivilegeRequired": true,
    "directProviderDatabaseAccessAllowed": false,
    "revocationMustRemoveFutureAccess": true,
    "providerUnavailableMustFailSafely": true,
    "credentialsOrReusableSecretsMayBeRecorded": false,
    "unnecessaryPrivatePayloadMayBeRecorded": false,
    "versionedOrOtherwiseExplicitContractRequired": true
  },
  "privacySecurityRules": {
    "privacyByDefaultRequired": true,
    "dataMinimizationRequired": true,
    "wardveilOwnsSystemSecurityProtectionTruth": true,
    "privacyShieldOwnsSystemPrivacyConsentTruth": true,
    "responsibleProviderMayClaimSystemWidePrivacyAuthority": false,
    "providerConflictsFailClosed": true,
    "unattestedTruthFailsClosed": true,
    "presentationCreatesTruth": false,
    "motionCreatesTruth": false,
    "colorCreatesTruth": false,
    "materialCreatesTruth": false,
    "permissionRevocationMustBeObservable": true,
    "credentialsOrReusableSecretsMayBeRecorded": false,
    "unnecessaryPrivatePayloadMayBeRecorded": false,
    "telemetryRequired": false
  },
  "section48IntegrationMap": {
    "machineControl": "contracts/v1.7/qualification.v1.3.machine.plan.json",
    "renderedControl": "contracts/v1.7/qualification.v1.3.rendered.plan.json",
    "provenanceControl": "contracts/v1.7/qualification.v1.3.provenance.plan.json",
    "humanControl": "contracts/v1.7/qualification.v1.2.human.plan.json",
    "fieldHumanControl": "contracts/v1.7/qualification.v1.2.field-human.plan.json",
    "assistiveTechnologyControl": "contracts/v1.7/qualification.v1.2.assistive-technology.plan.json",
    "deviceControl": "contracts/v1.7/qualification.v1.2.device.plan.json",
    "performanceControl": "contracts/v1.7/qualification.v1.2.performance.plan.json",
    "energyControl": "contracts/v1.7/qualification.v1.2.energy.plan.json",
    "providerIntegrationControl": "this-plan",
    "privacySecurityControl": "this-plan",
    "companionControlEvidenceAutomaticallyInherited": false,
    "section48FieldControl": "contracts/v1.7/qualification.v1.3.field.plan.json",
    "controlCoverage": "contracts/v1.7/qualification.v1.3.control-coverage.json"
  },
  "implementation": {
    "validator": "scripts/validate_glaze_v1_7_1_section48_trust_qualification.py",
    "workflow": ".github/workflows/glaze-v1.7.1-section48-trust-qualification-control.yml",
    "humanProcedure": "acceptance/v1.7.1-section48-trust-qualification.md",
    "providerIntegrationTemplate": "acceptance/v1.7.1-section48-provider-integration-evidence.template.json",
    "privacySecurityTemplate": "acceptance/v1.7.1-section48-privacy-security-evidence.template.json",
    "preparationHelper": "scripts/prepare_glaze_v1_7_1_section48_trust_qualification.py"
  },
  "currentBoundary": {
    "protocolEstablished": true,
    "providerIntegrationEvidenceEstablished": false,
    "privacySecurityEvidenceEstablished": false,
    "companionControlEvidenceAutomaticallyInherited": false,
    "section48EvidenceInventoryComplete": false,
    "section48Accepted": false,
    "v171AcceptanceEstablished": false,
    "lifecyclePromotionEstablished": false,
    "consumerAcceptanceEstablished": false,
    "deploymentAcceptanceEstablished": false,
    "publicationEstablished": false,
    "productionAcceptanceEstablished": false
  },
  "boundary": "This plan establishes fail-closed manual collection controls for the two Section 48 trust-specific evidence types that are not supplied by machine, rendered, device, assistive-technology, human, performance, energy, or provenance controls. A session-pass value is candidate evidence only. Real provider/privacy/security integration must be exercised, the record must exclude credentials and unnecessary private data, and separate governed review must accept the exact-source record before it can satisfy a Section 48 evidence group. No existing companion protocol automatically supplies or inherits these trust evidence types, and no record automatically establishes Section 48 acceptance, V1.7.1 lifecycle promotion, consumer eligibility, deployment, publication, or production acceptance."
}
